{"chain":"dogecoin","expiry":1792718860,"fees":{"listing_to":"DEXAMPLEMARKETADDRESSXXXXXXXXXXXXX","market_bps":"200"},"items":[{"inscription_id":"1111111111111111111111111111111111111111111111111111111111111111i0","sig":"30e1e1e1e1e1e1e1e1e1e1e1e1e1e1e1e1e1e1e1e1e1e1e1e1e1e1e1e1e1e1e1e1e1e1e1e1e1e1e1e1e1e1e1e1e1e1e1e1e1e1e1e1e1e1e1e1e1e1e1e1e1e1e1e1e1e1e1e1e1e183","utxo":"aaaaaaaaaaaaaaaaaaaaaaaaaaaaaaaaaaaaaaaaaaaaaaaaaaaaaaaaaaaaaaaa:0"},{"inscription_id":"2222222222222222222222222222222222222222222222222222222222222222i0","sig":"30e2e2e2e2e2e2e2e2e2e2e2e2e2e2e2e2e2e2e2e2e2e2e2e2e2e2e2e2e2e2e2e2e2e2e2e2e2e2e2e2e2e2e2e2e2e2e2e2e2e2e2e2e2e2e2e2e2e2e2e2e2e2e2e2e2e2e2e2e2e283","utxo":"bbbbbbbbbbbbbbbbbbbbbbbbbbbbbbbbbbbbbbbbbbbbbbbbbbbbbbbbbbbbbbbb:0"},{"inscription_id":"3333333333333333333333333333333333333333333333333333333333333333i0","sig":"30e3e3e3e3e3e3e3e3e3e3e3e3e3e3e3e3e3e3e3e3e3e3e3e3e3e3e3e3e3e3e3e3e3e3e3e3e3e3e3e3e3e3e3e3e3e3e3e3e3e3e3e3e3e3e3e3e3e3e3e3e3e3e3e3e3e3e3e3e3e383","utxo":"cccccccccccccccccccccccccccccccccccccccccccccccccccccccccccccccc:1"}],"op":"list","p":"dmp","pay_to":"DEXAMPLEPAYADDRESSXXXXXXXXXXXXXXXX","price":"1000000000","pubkey":"02abababababababababababababababababababababababababababababababab","ts":1792632460,"v":"2","asig":"AAAAAAAAAAAAAAAAAAAAAAAAAAAAAAAAAAAAAAAAAAAAAAAAAAAAAAAAAAAAAAAAAAAAAAAAAAAAAAAAAAAAAAA="}